{
  "$schema": "../skill-machine-contract-index.schema.json",
  "contract_count": 120,
  "contract_schema": {
    "path": "references/skill-machine-contract.schema.json",
    "sha256": "094a273aee4735c4feddebcb485bd5d50cd678e484713e0c1982d4693a86aef6"
  },
  "contracts": [
    {
      "contract_ref": "references/skill-contracts/narrative-baseline-mapper.json",
      "contract_sha256": "bc72925841bad6e141d4f8880376d644a10fa02582fefa63bd83129817bbcbdb",
      "skill": "narrative-baseline-mapper"
    },
    {
      "contract_ref": "references/skill-contracts/category-narrative-mapper.json",
      "contract_sha256": "6230348bc794453650a18e0082075ca23fa8b23707fe519adcc9119aeab91fd2",
      "skill": "category-narrative-mapper"
    },
    {
      "contract_ref": "references/skill-contracts/audience-belief-mapper.json",
      "contract_sha256": "1d51957e642a70de0b006b851ca3ea040436e308f7c61cc7dc172bb4916d91c7",
      "skill": "audience-belief-mapper"
    },
    {
      "contract_ref": "references/skill-contracts/positioning-truth-tracer.json",
      "contract_sha256": "b539ed4be3dab6627894e84226138812129bd6222cbaf2488306b6383759a48f",
      "skill": "positioning-truth-tracer"
    },
    {
      "contract_ref": "references/skill-contracts/strategic-narrative-designer.json",
      "contract_sha256": "42311ed5a54418d67f4a4367626f69a15b46b0fdf534c10daab95803f7ac8f50",
      "skill": "strategic-narrative-designer"
    },
    {
      "contract_ref": "references/skill-contracts/message-system-architect.json",
      "contract_sha256": "b76f7b2b276b5a6f99ba6bd60c799b13e0c50dfe11965fed5d4ee173ccc6747a",
      "skill": "message-system-architect"
    },
    {
      "contract_ref": "references/skill-contracts/brand-language-codifier.json",
      "contract_sha256": "44d36e0a44affe95b111a8d72f78375b8b02ee19d57e72c3debaab32274161b3",
      "skill": "brand-language-codifier"
    },
    {
      "contract_ref": "references/skill-contracts/story-bank-builder.json",
      "contract_sha256": "8f27b89abdca09c7811c2e586eb1cf64c43186fe048ac6bdec459ea673488279",
      "skill": "story-bank-builder"
    },
    {
      "contract_ref": "references/skill-contracts/narrative-cascade-planner.json",
      "contract_sha256": "b5bbb2a6ceceed439a4611be8f0dbe10ebe501db9891cc2f8e1eb7a6fb5e53e1",
      "skill": "narrative-cascade-planner"
    },
    {
      "contract_ref": "references/skill-contracts/pitch-narrative-builder.json",
      "contract_sha256": "bf1d0661b690cec3fda2594bed7a085fbed105ffd3d63885b512973926afa6cb",
      "skill": "pitch-narrative-builder"
    },
    {
      "contract_ref": "references/skill-contracts/narrative-enablement-kit.json",
      "contract_sha256": "005ff1aba0f5554561f9aad1d7defd83fe176f6193a3de0fa2967fb3d0860151",
      "skill": "narrative-enablement-kit"
    },
    {
      "contract_ref": "references/skill-contracts/proof-point-packager.json",
      "contract_sha256": "d297898dcf60f5558cf03f4c6edfe2e1cadfb1191b0b683b0ca714e12f91b5b8",
      "skill": "proof-point-packager"
    },
    {
      "contract_ref": "references/skill-contracts/narrative-quality-auditor.json",
      "contract_sha256": "287296ca661494c5d2eb1c96670ac8df34fd5c1baf2ac4b61c3ac490d1f53d2e",
      "skill": "narrative-quality-auditor"
    },
    {
      "contract_ref": "references/skill-contracts/message-test-designer.json",
      "contract_sha256": "b20579ef0f54a9c8f03324fbf1fc2c5751cff253c6e5caab85b9e36a99ef6d72",
      "skill": "message-test-designer"
    },
    {
      "contract_ref": "references/skill-contracts/narrative-resonance-monitor.json",
      "contract_sha256": "5e27d458e072a2949a8b9a5fec21220be790861d66d12551ee5a0e41f94d95bd",
      "skill": "narrative-resonance-monitor"
    },
    {
      "contract_ref": "references/skill-contracts/narrative-drift-monitor.json",
      "contract_sha256": "0fdb21c60df2c56dad8883f0286e641b5e5e6bfba4c359108bf02a3fc2b3f675",
      "skill": "narrative-drift-monitor"
    },
    {
      "contract_ref": "references/skill-contracts/keyword-research.json",
      "contract_sha256": "c1718cf8f8ae5d78de6b3e84e58b7a574f6b706a310cc5cc285e2b8ee001b57a",
      "skill": "keyword-research"
    },
    {
      "contract_ref": "references/skill-contracts/competitor-analysis.json",
      "contract_sha256": "83f2ccd2ec393b70d68c43d5df77718aad7cbc0dd578f07fae876d4dbf641c29",
      "skill": "competitor-analysis"
    },
    {
      "contract_ref": "references/skill-contracts/serp-analysis.json",
      "contract_sha256": "b95f2bf159f2c8bbc5f9520d09675b68c550618902a3d01a4e47ec7176f1eee3",
      "skill": "serp-analysis"
    },
    {
      "contract_ref": "references/skill-contracts/content-gap-analysis.json",
      "contract_sha256": "bb99085b8ff7d144620017b06eb8b2d77d7703dcf27a5586ecd9677401275aad",
      "skill": "content-gap-analysis"
    },
    {
      "contract_ref": "references/skill-contracts/content-writer.json",
      "contract_sha256": "73a846ccb2a3a7a8957ca43dc37a7e89938b3c8af903cb91d68688f881ca6abc",
      "skill": "content-writer"
    },
    {
      "contract_ref": "references/skill-contracts/geo-content-optimizer.json",
      "contract_sha256": "f0e521e47d9b34c3fc1d01ed45cf8a6dbbfd8e885c6728a69cd23185cada1c00",
      "skill": "geo-content-optimizer"
    },
    {
      "contract_ref": "references/skill-contracts/serp-markup-builder.json",
      "contract_sha256": "a08fba7daf018ac49168935bdc70fe581cbe62ba431daedc986ee15c0a9800b2",
      "skill": "serp-markup-builder"
    },
    {
      "contract_ref": "references/skill-contracts/page-play-builder.json",
      "contract_sha256": "c8d2e231e6ac24f2345df0eac5bf4940516c33a64e6cc1c83a246961d418f87b",
      "skill": "page-play-builder"
    },
    {
      "contract_ref": "references/skill-contracts/content-quality-auditor.json",
      "contract_sha256": "e6ab1ac9f5cb030142158bd9d7b18602569789cb7e27c10f292bb870d6e3a895",
      "skill": "content-quality-auditor"
    },
    {
      "contract_ref": "references/skill-contracts/technical-seo-checker.json",
      "contract_sha256": "682290dd5143c394590903a0393ba8271da70f761cef00e13073ddf0e33cc64d",
      "skill": "technical-seo-checker"
    },
    {
      "contract_ref": "references/skill-contracts/on-page-seo-checker.json",
      "contract_sha256": "bbb3ae23d69c6c50f7695b7350c9cedde3c2ff73a251f7325941bf3100169114",
      "skill": "on-page-seo-checker"
    },
    {
      "contract_ref": "references/skill-contracts/site-structure-optimizer.json",
      "contract_sha256": "f40458d9488b7da1ef920c6320aeb6518e03d7f33f3d89190e4332eca275bf52",
      "skill": "site-structure-optimizer"
    },
    {
      "contract_ref": "references/skill-contracts/domain-authority-auditor.json",
      "contract_sha256": "00189f0f67b178f998506a99473b767fcd3ac6c3dde0f5fc116655e2c5b2c452",
      "skill": "domain-authority-auditor"
    },
    {
      "contract_ref": "references/skill-contracts/rank-tracker.json",
      "contract_sha256": "61a3b08de966d3b4e5f1a334b765890bf8c9235656cd9e188f48351a76f855e4",
      "skill": "rank-tracker"
    },
    {
      "contract_ref": "references/skill-contracts/performance-monitor.json",
      "contract_sha256": "ba9c0ba431a7efedaed6e0913598393582bb526e96d51f17e0f80bd49350ad06",
      "skill": "performance-monitor"
    },
    {
      "contract_ref": "references/skill-contracts/offsite-signal-analyzer.json",
      "contract_sha256": "e4e8902964f4075bbdab63a64cbfe777f383d5004f76c41d98f039650eb88aee",
      "skill": "offsite-signal-analyzer"
    },
    {
      "contract_ref": "references/skill-contracts/channel-portfolio-planner.json",
      "contract_sha256": "9d6e2175a2fe3c71ee7cd3612fa9ff3c739f1628c76a6c0471ca57a3fc137867",
      "skill": "channel-portfolio-planner"
    },
    {
      "contract_ref": "references/skill-contracts/voice-dossier-builder.json",
      "contract_sha256": "d4252585ae0262c67fe8edb6ca23e0da11e0fbb6548df55a02571452c7e3e85f",
      "skill": "voice-dossier-builder"
    },
    {
      "contract_ref": "references/skill-contracts/platform-norm-profiler.json",
      "contract_sha256": "c9c60489ab102b4aba2a6266fa39737bba4e132ea6834754fd6ce4d969fc430b",
      "skill": "platform-norm-profiler"
    },
    {
      "contract_ref": "references/skill-contracts/participation-warmup-planner.json",
      "contract_sha256": "b2f3b67f3a8235b866e4e0efa36672cf84b3ec5b09c4078b6ae79e2d48bfef0b",
      "skill": "participation-warmup-planner"
    },
    {
      "contract_ref": "references/skill-contracts/social-calendar-builder.json",
      "contract_sha256": "9fc72d15dd588d6bb47571c3fbfa85a0a977ab92eb6bd1646c5f198154747949",
      "skill": "social-calendar-builder"
    },
    {
      "contract_ref": "references/skill-contracts/social-creative-builder.json",
      "contract_sha256": "314b869cd07c89d937817b3744ed15e48dd10fa8532c8282603629615398574a",
      "skill": "social-creative-builder"
    },
    {
      "contract_ref": "references/skill-contracts/short-video-scripter.json",
      "contract_sha256": "2e6b4de1a86556ddf34fb39830215f94cbd8e02e6bb5c82c84fc7e1c668ee74a",
      "skill": "short-video-scripter"
    },
    {
      "contract_ref": "references/skill-contracts/advocacy-program-designer.json",
      "contract_sha256": "e4f3a41e93918658f05e7ac66b66c41b06ef4a9ca35cc7007d28c243dc3bb53f",
      "skill": "advocacy-program-designer"
    },
    {
      "contract_ref": "references/skill-contracts/social-quality-auditor.json",
      "contract_sha256": "6a42643c75299f4f6e79d8fa0858be760542bed0798c95d8bc76156b70a9485a",
      "skill": "social-quality-auditor"
    },
    {
      "contract_ref": "references/skill-contracts/engagement-inbox-manager.json",
      "contract_sha256": "54f442f6402221e43e1f46d25677718464cfa5f6cf9e4db0706498cd6a1e6789",
      "skill": "engagement-inbox-manager"
    },
    {
      "contract_ref": "references/skill-contracts/social-selling-planner.json",
      "contract_sha256": "69351999101a0ac3a6f253997c0ed7f03b1ee865a2d7960a8d13c0892ebef515",
      "skill": "social-selling-planner"
    },
    {